id;id_ex;siret;gestion;date_creat;date_publi;nature;groupement;titre;objet;objet_social1;objet_social2;adr1;adr2;adr3;adrs_codepostal;libcom;adrs_codeinsee;dir_civilite;siteweb;observation;position;rup_mi;maj_time
"9N1P0981000483";"0981000483";"";"9N1P";"2004-11-08";"0001-01-01";"D";"S";"FA'U FENUA, NOTRE DEFI";"1) La promotion , la diffusion, et l'échange d'information concernant les principes et règles de développement endogène aux population de la Nouvelle-Calédonie; 2) De favoriser la réflexion et l'échange entre hommes et femmes responsables exerçant notamment des professions ou occupations différentes; 3) De démontrer que toute profession ou occupation exercée avec honneur et conscience est utile à la communauté...";"020000";"009050";"c/o Foyer Wallisien et Futunien de NC";"187 rue Roger Gervolino - Aérodrome - BP 1872 - 98845 .";"98800 Nouméa";"98800";"NOUMEA";"98818";"PM";"";"W9N1010308";"R";"";"2018-12-19  12:54:00"
"9N1P0981000485";"0981000485";"";"9N1P";"2004-11-30";"2004-12-14";"D";"S";"DESMO OWNERS OF CALEDONIA - NOUMEA";"Promouvoir la pratique loisir, sportive, l'image et la connaissance des motos de marque DUCATI en Nouvelle Calédonie... Développer la pratique des deux roues motorisés ... Défendre leurs utilisateurs en tant qu'usagers de la route et en tant que consommateurs. Agir pour la sécurité, la prévention et le partage de la route ... Promouvoir les valeurs de solidarité, d'égalité et de liberté, visant à permettre au plus grand nombre la pratique des deux roues motorisés dans un esprit de responsabilité";"011160";"007000";"368, lot Ducros, rue des Roseaux";"Vallon Dore";"";"98810";"MONT DORE";"98817";"PM";"";"W9N1005334";"R";"";"2016-02-12  02:38:27"
"9N1P0981000487";"0981000487";"";"9N1P";"2005-02-15";"2005-03-22";"D";"S";"ASSOCIATION SAINT-LOUIS VOYAGES";"* Promouvoir, développer et aider toutes organisations de voyages pour les habitants de la tribu de Saint-Louis... * Promouvoir les rencontres, les échanges et le développement des relations socioculturelles entre associations en Nouvelle-Calédonie et hors Nouvelle-Calédonie, * Préserver l'environnement et le patrimoine dans lesquels l'association évolue.";"023040";"016000";"lot 150";"Tribu de Saint-Louis";"";"98810";"MONT DORE";"98817";"PM";"";"W9N1010286";"R";"";"2018-12-19  12:22:33"
"9N1P0981000488";"0981000488";"";"9N1P";"2004-11-22";"2004-12-07";"D";"S";"CHAMBRE PROFESSIONNELLE DES AGENTS DE COMPTABILITE";"- D'assurer la défense de l'honneur et de l'indépendance de la profession qu'elle représente.";"014000";"022542";"4 , rue Schmitt , Sainte - Marie Nouméa";"";"";"98800";"NOUMEA";"98818";"PM";"";"W9N1004625";"R";"";"2014-01-02  01:33:05"
"9N1P0981000490";"0981000490";"";"9N1P";"2004-11-22";"2004-12-21";"D";"S";"ASSOCIATION MARSUBI BUDAYA INDONESIA NOUVELLE CALEDONIE ( A.M.B.I.N.C)";"- De promouvoir la culture artistique et artisanale indonésienne.";"020000";"016000";"2 , rue Lamartine Baie de l'Orphelinat .";"BP 26 - 98845";"";"98800";"NOUMEA";"98818";"PM";"";"W9N1010287";"R";"";"2018-12-19  12:30:53"
"9N1P0981000494";"0981000494";"";"9N1P";"2004-11-22";"2004-12-07";"D";"S";"L'ASSOCIATION LES GRAINES DE NOTRE PATRIMOINE ( G.N.P)";"- De faire découvrir les richesses de notre patrimoine naturel; - D'aider les jeunes à se former et de les suivre dans leur étude ; - D'organiser l'ouverture sur le monde extérieur à la commune.";"014000";"018010";"11 , rue de Touho Mont-Ravel";"";"";"98800";"NOUMEA";"98818";"PM";"";"W9N1010288";"R";"";"2018-12-19  12:34:34"
"9N1P0981000495";"0981000495";"";"9N1P";"2005-03-30";"2005-03-30";"D";"S";"ASSOCIATION POUR LA SAUVEGARDE DES RUES MOULIN ET GOYETCHE";"Défendre les habitants des rues J. MOULIN et GOYETCHE contre la densification inquiétante des constructions ; mettant en cause la sécurité, l'engorgement des voies et la qualité de vie de ses riverains.";"014000";"032520";"4, rue Goyetche";"PK7";"";"98800";"NOUMEA";"98818";"PM";"";"W9N1005139";"R";"";"2015-06-29  06:11:14"
"9N1P0981000500";"0981000500";"";"9N1P";"2005-10-27";"2005-11-08";"D";"S";"PENCAK SILAT BETAKO MERPATI PUTIH CABANG NOUVELLE-CALEDONIE";"De promouvoir le MERPATI PUTIH en Nouvelle-Calédonie et dans le Pacifique. L'organisation de manifestation tendant à faire connaître l'art et le développer. Effectuer le planning annuel prévisionnel pour toutes les associations de Pencak Silat Merpati Putih de la Nouvelle-Calédonie.";"011000";"000000";"15, Lot Palmeraies";"Pont des Français";"";"98810";"MONT DORE";"98817";"PM";"";"W9N1010289";"R";"";"2018-12-19  12:39:04"
"9N1P0981000501";"0981000501";"";"9N1P";"2005-10-27";"2005-11-08";"D";"S";"CLUB PENCAK SILAT NOUMEA BETAKO MERPATI-PUTIH";"L'enseignement du Pencak Silat style Merpati-Putih. La participation aux diverses compétitions. L'organisation de diverses manifestations tendant à promouvoir le Pencak Silat style Merpati-Putih.";"011000";"000000";"Rue Lamartine - Orphelinat";"Consulat d'Indonésie";"";"98800";"NOUMEA";"98818";"PM";"";"W9N1010290";"R";"";"2018-12-19  12:41:32"
"9N1P0981000503";"0981000503";"";"9N1P";"2005-03-30";"2005-05-30";"D";"S";"ASSOCIATION DES PARENTS D'ELEVES DE L'ECOLE MATERNELLE LES NIAOULIS";"- Oeuvrer pour le bien être des élèves. - Etudier tout ce qui concerne l'intérêt au point de vue moral, intellectuel et matériel. - Faciliter les rapports entre les parents, le corps enseignant et les autorités dont relève l'établissement. - Assurerla représentation des familles dans les éventuels conseils et organismes existant dans l'établissement. - Apporter son concours à l'administration de l'établissement en vue d'améliorer les conditions de vie scolaire des élèves.";"015000";"015005";"Ecole Maternelle Les Niaoulis";"Quartier Jacarandas";"";"98830";"DUMBEA";"98805";"PM";"";"";"A";"";"2006-11-07  11:34:50"
"9N1P0981000505";"0981000505";"";"9N1P";"2005-03-30";"2005-03-30";"D";"S";"ASSOCIATION 'RASSEMBLER POUR L'AVENIR'";"Rassembler toutes les personnalités, groupes et formations politiques, économiques et sociales qui ont la volonté d'oeuvrer à la sauvegarde et à la prospérité de la collectivité territoriale calédonienne dans le cadre de la République Française, dansle respect de l'ordre et de la légalité, de la sécurité des personnes et des biens, particulièrement dans la Commune du Mont-Dore d'où émane le noyau fondateur.";"001000";"001005";"29 lotissement Porte Dore";"";"";"98810";"MONT DORE";"98817";"PM";"";"W9N1010291";"R";"";"2018-12-19  12:44:35"
"9N1P0981000506";"0981000506";"";"9N1P";"2005-03-30";"0001-01-01";"D";"S";"ASSOCIATION TOUTES ETHNIES RASSEMBLEES";"D'organiser des soirées amicales (jeux, tombola, soirées récréatives avec goùter).";"007000";"009000";"80 lot Municipal";"C/o Francky";"";"98800";"NOUMEA";"98818";"PM";"";"W9N1010292";"R";"";"2018-12-19  12:47:32"
"9N1P0981000507";"0981000507";"";"9N1P";"2005-03-30";"0001-01-01";"D";"S";"ASSOCIATION TERMINALE LITTERAIRE DE DO KAMO 2005";"Favoriser l'obtention du baccalauréat par tout moyen ou action pouvant conforter le programme d'enseignement de ses membres étudiant en Terminal LITTERAIRE du Lycée DO KAMO.";"015000";"000000";"15 bis, rue Taragnat";"Vallée des Colons - Lycée DO KAMO";"";"98800";"NOUMEA";"98818";"PM";"";"W9N1010293";"R";"";"2018-12-19  12:50:08"
"9N1P0981000508";"0981000508";"";"9N1P";"2001-12-13";"0001-01-01";"D";"S";"FORMA - JEUNE";"- Le developpement des formations de secourisme, et des activitées de pleine nature , tel que : technique de survie , orientation, rendonnée pédestre , bivouac etc...";"036000";"016530";"Robinson";"BP 2423 Pont des Français";"";"98810";"MONT DORE";"98817";"PM";"";"W9N1010294";"R";"";"2018-12-19  12:53:12"
"9N1P0981000511";"0981000511";"";"9N1P";"2001-12-11";"0001-01-01";"D";"S";"INSTITUT CALEDONIEN POUR LA VALORISATION DE LA QUALITE DES ENTREPRISES ET DES ARTISANTS DANS LE BATIMENT ( ICV.QUEA.BAT)";"- La défense des intérêts des maitres d'ouvrage privés ou public, pour valoriser et parfaire la qualité de mise en oeuvre de tous les travaux de rénovation, d'extension de construction, ou de tous travaux en général, réalisés par des entreprises et artisans du bâtiment ou des travaux publics.";"030005";"020000";"80 , bis route de l'Anse Vata - Trianon";"";"";"98800";"NOUMEA";"98818";"PM";"";"W9N1010295";"R";"";"2018-12-19  12:55:48"
"9N1P0981000516";"0981000516";"";"9N1P";"2005-01-24";"0001-01-01";"D";"S";"HELICLUB OIZO";"Faire connaître, promouvoir et développer la pratique de l'hélicoptère et des sports aériens en général.";"011000";"011135";"10, rue Carcopino";"";"";"98800";"NOUMEA";"98818";"PM";"";"W9N1010296";"R";"";"2018-12-19  12:58:30"
"9N1P0981000518";"0981000518";"";"9N1P";"2005-02-02";"0001-01-01";"D";"S";"CYCLO CLUB DE NOUVELLE-CALEDONIE";"Encourager et développer le cyclisme sous toutes ses formes sur le Territoire de la Nouvelle-Calédonie, défendre les intérêts de ses licenciés, soutenir leurs efforts et les informer.";"011000";"011180";"1, rue Pointe Lasalle Tina Golf";"BP 14933";"";"98800";"NOUMEA";"98818";"PM";"";"W9N1004891";"R";"";"2014-09-16  09:35:13"
"9N1P0981000519";"0981000519";"";"9N1P";"2001-11-21";"0001-01-01";"D";"S";"ASSOCIATION DES PECHEURS PALANGRIERS DE NC";"- La défense des intérêts des pêcheurs palangriers de Nouvelle-Calédonie.";"014000";"024035";"44 , bis Avenue James Cook Nouville";"";"";"98800";"NOUMEA";"98818";"PM";"";"W9N1010297";"R";"";"2018-12-19  12:15:57"
"9N1P0981000520";"0981000520";"";"9N1P";"2001-11-20";"0001-01-01";"D";"S";"AS / RIMAP";"- Le développement et la pratique des activités sportives des personnes militaires du RIMAP-NC dans le cadre du loisirs et de la compétition.";"038000";"011000";"PLUM - Service des Sports RIMAP-NC";"BP 1060 - 98842 Nouméa Cedex.";"";"98810";"MONT DORE";"98817";"PM";"";"W9N1009859";"R";"";"2018-11-27  11:15:54"
"9N1P0981000522";"0981000522";"";"9N1P";"2005-02-02";"2005-03-01";"D";"S";"NOVARA";"Promotion de la plongée en apnée dans le lagon calédonien, principalement, visite des récifs des côtes est, ouest et la corne sud de la Grande Terre. Photographies et films sous marins.";"011095";"024025";"19, rue de Verteuil";"";"";"98800";"NOUMEA";"98818";"PM";"";"W9N1010298";"R";"";"2018-12-19  12:19:29"
"9N1P0981000523";"0981000523";"";"9N1P";"2001-11-22";"0001-01-01";"D";"S";"KUNIE NATURE";"- Le développement du tourisme en général a l'Ile des Pins plus particulièrement : - le tourisme chez l'habitant, l'éco tourisme, - le touriste en tribu , l'activité de guide touristique à Kunié; - développer le randonné pédestre, - sauvegarder l'environnement , le patrimoine; - tourisme sportif , le raid ; - tourisme Vert.";"022000";"034000";"Vao , Ile des Pins";"BP 40";"";"98832";"ILES DES PINS";"98809";"PM";"";"W9N1010309";"R";"";"2018-12-19  12:55:48"
"9N1P0981000526";"0981000526";"";"9N1P";"2001-11-20";"0001-01-01";"D";"S";"PAYS - AVENIR";"- D'alimenter la réflexion sur l'évolution économique , sociale, politique et culturelle de la Nouvelle Calédonie au moyen d'actions de sensibilsation et d'initiatives diverses.";"001000";"001005";"32 , rue Loriot de Rouvray Nouméa";"BP 8401 - 98807";"";"98800";"NOUMEA";"98818";"PM";"";"W9N1010301";"R";"";"2018-12-19  12:26:11"
"9N1P0981000527";"0981000527";"";"9N1P";"2005-02-02";"0001-01-01";"D";"S";"HAGIEN";"Soutenir les vanuatuans de Tana, résidant en Nouvelle-Calédonie, à accomplir les différentes démarches administratives, intégrer dans la législation calédonienne, aider en cas de catastrophes naturelles, éduquer les enfants ... pourvoir aux moyens des plus défavorisés.";"014000";"019000";"154, Route des sources";"La Coulée";"";"98810";"MONT DORE";"98817";"PM";"";"W9N1005167";"R";"";"2015-07-29  07:16:14"
"9N1P0981000528";"0981000528";"";"9N1P";"2005-01-12";"0001-01-01";"D";"S";"ASSOCIATION SPORTIVE PETANQUE VALLEE DU TIR";"Aider les jeunes de la Vallée du Tir à faire du Sport";"011000";"011035";"80, rue Municipal";"Doniambo - Vallée du Tir";"";"98800";"NOUMEA";"98818";"PM";"";"W9N1010313";"R";"";"2018-12-19  12:03:10"
"9N1P0981000529";"0981000529";"";"9N1P";"2006-03-30";"0001-01-01";"D";"S";"ROCK & CO (R & C)";"Initiation à la danse : rock'n roll et autres... - Soirées et animations diverses; - Démonstrations; - Voyages ayant pour buts d'éventuels stages et/ou démonstrations.";"006000";"006040";"12, rue Saint Saëns PK 4";"BP 4930";"";"98800";"NOUMEA";"98818";"PM";"";"W9N1010030";"R";"";"2018-12-04  12:32:00"
"9N1P0981000530";"0981000530";"";"9N1P";"2004-11-08";"0001-01-01";"D";"S";"AB - ZILIWA";"Promouvoir aux besoins sociaux, éducatifs, de formation et de loisirs de ses adhérents.";"014000";"019000";"6, rue Griscelli";"Rivière Salée";"";"98800";"NOUMEA";"98818";"PM";"";"W9N1010314";"R";"";"2018-12-19  12:04:37"
"9N1P0981000531";"0981000531";"";"9N1P";"2001-11-20";"0001-01-01";"D";"S";"VIVE LES VACANCES";"- Découvertes et connaissances approfondies de la Nouvelle Calédonie et des pays du Pacifique.";"007000";"009020";"44 , rue Capiez Porte de fer";"";"";"98800";"NOUMEA";"98818";"PM";"";"W9N1010315";"R";"";"2018-12-19  12:06:29"
"9N1P0981000533";"0981000533";"";"9N1P";"2004-11-03";"2004-11-30";"D";"S";"VIE EN NOUVELLE-CALEDONIE, RESSOURCES ET ENSEIGNEMENT(VINCRE)";"- Amélioration de la santé et le maintien de la solidarité entre les habitants de Nouvelle-Calédonie, ... Les moyens seront l'information et l'enseignement sur les problèmes de santé, les discussions sur les réformes du système de santé, les problèmes sociaux et ethniques, l'intégration des nouveaux arrivants, l'amélioration des ressources du territoire.";"017000";"017085";"8, rue Paul Guiraud";"Motor Pool";"";"98800";"NOUMEA";"98818";"PM";"";"W9N1010316";"R";"";"2018-12-19  12:08:26"
"9N1P0981000534";"0981000534";"";"9N1P";"2001-11-14";"0001-01-01";"D";"S";"A . P . E . R . S . A . C";"- Promouvoir la recherche et l'étude des relations entre santé et cultures en particuliers en Nouvelle-Calédonie.";"017000";"006000";"5 , rue de la Bretagne Nouméa.";"";"";"98800";"NOUMEA";"98818";"PM";"";"W9N1010320";"R";"";"2018-12-19  12:17:01"
"9N1P0981000536";"0981000536";"";"9N1P";"2004-11-03";"0001-01-01";"D";"S";"LAOSIAN BOXING";"- La remise en forme; - Entraînement à la boxe; - Self défense";"011000";"011145";"83 Route du Port Despointes";"";"";"98800";"NOUMEA";"98818";"PM";"";"W9N1010317";"R";"";"2018-12-19  12:10:54"
"9N1P0981000537";"0981000537";"";"9N1P";"2001-11-14";"0001-01-01";"D";"S";"LINKS";"1) C'est une association anglophone; 2) Aider les défavorisées de Nouvelle-Calédonie.";"019040";"020000";"4 , rue du 24 Septembre , Magenta";"";"";"98800";"NOUMEA";"98818";"PM";"";"W9N1010318";"R";"";"2018-12-19  12:12:55"
"9N1P0981000538";"0981000538";"";"9N1P";"2005-01-05";"2005-01-05";"D";"S";"ASSOCIATION LES AMIS DE THIERRY";"L'aide apportée à la famille de Thierry Ali par tout moyen qu'elle parviendra à mettre en oeuvre.";"020000";"024000";"18, lot Deschamps";"Mont-Mou";"";"98890";"PAITA";"98821";"PM";"";"W9N1010319";"R";"";"2018-12-19  12:14:47"
"9N1P0981000541";"0981000541";"";"9N1P";"2004-10-29";"2004-12-28";"D";"S";"ASSOCIATION JEUNESSE LIBRE PWEITA";"Promouvoir les activités socio-éducatives au sein de la Jeunesse de Paita, aider les enfants et le jeunes à devenir des citoyens, des hommes et des femmes dévoués et utiles dans notre société.";"014000";"018010";"Lot 70";"Les Scheffleras";"";"98890";"PAITA";"98821";"PM";"";"W9N1010303";"R";"";"2018-12-19  12:32:33"
"9N1P0981000543";"0981000543";"";"9N1P";"2001-11-12";"0001-01-01";"D";"S";"ASSOCIATION POUR LE FINACEMENT DU PARTI <<LIBERATION KANAK SOCIALISTE>>";"- Rechercher et percevoir des moyens financiers par tous moyens légaux pour l'organisation et le financement de toutes opérations électorales et politique sur l'ensemble du territoire de la Nouvelle-Calédonie.";"001000";"001015";"16 , rue d'Austerlitz - Nouméa";"";"";"98800";"NOUMEA";"98818";"PM";"";"W9N1006156";"R";"";"2018-07-12  07:48:46"
"9N1P0981000545";"0981000545";"";"9N1P";"2005-01-05";"2005-01-05";"D";"S";"ASSOCIATION DE LA FONDATION COLLECTIVE 'MALUI' DANS LE PACIFIQUE (L'A.F.O.C.M.A.P.)";"De défendre nos intérêts avec les dispositions prévues dans la Déclaration des Droits de l'Homme en respectant les valeurs essentielles de la démocratie.";"001000";"000000";"5, rue Paul Mascart";"3ème Secteur - Rivière Salée";"";"98800";"NOUMEA";"98818";"PM";"";"W9N1010304";"R";"";"2018-12-19  12:42:33"
"9N1P0981000547";"0981000547";"";"9N1P";"2002-02-14";"0001-01-01";"D";"S";"TEAM RALLY 4B +";"- De financer une écurie de Rally automobile pour la siason 2003";"011000";"011160";"2 , rue Bichon Logicoop Nouméa.";"";"";"98800";"NOUMEA";"98818";"PM";"";"W9N1010305";"R";"";"2018-12-19  12:45:21"
"9N1P0981000549";"0981000549";"";"9N1P";"2004-10-26";"2004-11-30";"D";"S";"OLA-URI-NO NOUMEA";"Développer la solidarité, l'entente et l'entraide entre les membres adhérents, leurs familles et leurs amis vivant à Nouméa et dans les tribus de Tenane et Thogone. Les principaux objectifs sont : * favoriser la réussite scolaire de nos enfants ... *accompagner l'insertion professionnelle des jeunes ... * apporter une aide matérielle et/ou spirituelle aux adhérents, à leurs familles et amis; * s'ouvrir aux autres communautés vivant en Nouvelle-Calédonie.";"019005";"024000";"lot 765, 5 rue Le Rhin";"Koutil";"";"98830";"DUMBEA";"98805";"PM";"";"W9N1005296";"R";"";"2015-12-16  12:23:55"
"9N1P0981000550";"0981000550";"";"9N1P";"2004-10-19";"0001-01-01";"D";"S";"INSTITUT BIBLIQUE DES ILES DU PACIFIQUE";"Dispense d'enseignement pour la formation des pasteurs, des moniteurs et monitrices de l'école du dimanche, des laïcs ainsi que toute personne désirant étudier la parole de Dieu.";"040000";"040810";"28, rue Oules";"";"";"98800";"NOUMEA";"98818";"PM";"";"W9N1010306";"R";"";"2018-12-19  12:49:33"
"9N1P0981000551";"0981000551";"";"9N1P";"2004-10-19";"2004-11-02";"D";"S";"L'OASIS DU PEAGE";"Gestion de la consommation de l'eau des personnes domiciliées au squatt du péage disposant d'un compteur individuel relié à celui de la Calédonienne des Eaux, notamment les relevés des compteurs, les facturations, le paiement et l'entretien du réseau.";"014000";"032520";"BP KO 492";"";"";"98830";"DUMBEA";"98805";"PM";"";"W9N1010528";"R";"";"2018-12-21  12:12:35"
"9N1P0981000552";"0981000552";"";"9N1P";"2004-10-26";"2004-11-23";"D";"S";"LES ENFANTS MIGRATEURS";"* Réunir différents artistes du territoire travaillant sur différents supports (musique, vidéo, théâtre, conte, arts plastiques) afin de proposer des créations et participer activement à la vie culturelle du territoire.";"006000";"006030";"8, rue des Frères Lecas";"Haut Magenta";"";"98800";"NOUMEA";"98818";"PM";"";"";"A";"";"2006-11-07  11:34:50"
"9N1P0981000556";"0981000556";"";"9N1P";"2004-10-26";"0001-01-01";"D";"S";"ASSOCIATION DES APPRENTIS COMPTABLE (2AC)";"Promouvoir la classe de BTS comptabilité gestion des organisations, ainsi que diversifier ses connaissances en comptabilité.";"015000";"015045";"14 rue de Verdun";"";"";"98800";"NOUMEA";"98818";"PM";"";"W9N1010529";"R";"";"2018-12-21  12:14:34"
"9N1P0981000558";"0981000558";"";"9N1P";"2004-10-26";"2004-11-09";"D";"S";"NTM COLLEGE BIBLIQUE (NTM CENTRE D'ADORATION FAMILIAL)";"- Mise en place des étudiants à plein temps pendant quatre années (4) . Précher l'évangile de JESUS CHRIST - Guérir les malades.";"040000";"040820";"15 , rue du Docteur Guégan - Quartier Latin - Im Alpe 2èt.";"";"";"98800";"NOUMEA";"98818";"PM";"";"";"A";"";"2006-11-07  11:34:50"
"9N1P0981000559";"0981000559";"";"9N1P";"2005-11-04";"2005-12-06";"D";"S";"ASSOCIATION YCKAJ";"De subvenir aux besoins de notre père qui est atteint de la maladie ALZEIHMER. Certains frais ne sont pas pris en charge. De palier à la bonne marche des études de nos enfants car nous comptons au moins 10 enfants âgés de 3 à 20 ans.";"019005";"000000";"6, rue Antoine Griscelli";"2ème Secteur - Rivière Salée";"";"98800";"NOUMEA";"98818";"PM";"";"W9N1010530";"R";"";"2018-12-21  12:16:42"
"9N1P0981000562";"0981000562";"";"9N1P";"2004-10-18";"0001-01-01";"D";"S";"TAWAKAJA";"Le bien être des enfants";"014000";"019005";"46, rue Gilbert Allegre";"Val de Magenta";"";"98800";"NOUMEA";"98818";"PM";"";"";"A";"";"2006-11-07  11:34:50"
"9N1P0981000563";"0981000563";"";"9N1P";"2004-10-14";"0001-01-01";"D";"S";"NEO-D-ZINE";"* Développer la mode et les tendances de coiffure; * Améliorer les capacités techniques des membres; * Coiffer les évènements artistiques sur la Calédonie et représenter la Calédonie durant les évènements : coiffure, mode international ...";"014000";"023004";"48, rue G. Laroque";"Val Plaisance";"";"98800";"NOUMEA";"98818";"PM";"";"W9N1010531";"R";"";"2018-12-21  12:18:38"
"9N1P0981000564";"0981000564";"";"9N1P";"2002-02-07";"0001-01-01";"D";"S";"ASSOCIATION CREATIVE DE LA JEUNESSE DE MELE";"- De répondre à plusieurs micros projets, afin d'encadrer une meilleure vie sociale pour chacun et chacune.";"022542";"023000";"32 , rue Edouard Unger , Vallée du Tir - Nouméa";"";"";"98800";"NOUMEA";"98818";"PM";"";"W9N1010532";"R";"";"2018-12-21  12:20:24"
"9N1P0981000566";"0981000566";"";"9N1P";"2002-02-06";"0001-01-01";"D";"S";"AIDE AU LOGEMENT KOUTIO DES PALMIERS";"- Défendre les droits des locataires ; l'amélioration des conditions de vie.";"014000";"022520";"Koutio - Dumbéa";"";"";"98830";"DUMBEA";"98805";"PM";"";"W9N1010533";"R";"";"2018-12-21  12:23:05"
"9N1P0981000569";"0981000569";"";"9N1P";"2004-10-14";"2004-10-26";"D";"S";"MACN (MINI AUTO CLUB NOUMEEN)";"Pratique des voitures radiocommandées thermiques et électriques.";"007000";"007025";"Noumea";"";"";"98800";"NOUMEA";"98818";"PM";"";"W9N1010394";"R";"";"2018-12-19  12:57:56"
"9N1P0981000570";"0981000570";"";"9N1P";"2004-10-14";"0001-01-01";"D";"S";"SIAKI NOA";"* Sauvegarder le patrimoine culturel et coutumier wallisien; * Développer les échanges socio-culturels; * Adapter les diverses cultures pour favoriser l'information et l'insertion des jeunes dans la société.";"018010";"024035";"44, rue Albert 1er";"Vallée des Colons";"";"98800";"NOUMEA";"98818";"PM";"";"W9N1010395";"R";"";"2018-12-19  12:59:44"
"9N1P0981000571";"0981000571";"";"9N1P";"2005-11-07";"2005-11-22";"D";"S";"ETHNOSONG";"Promouvoir des artistes de nationalité française issus de différentes cultures ou communautés. .......";"006000";"000000";"1, Morcellement du Lac";"";"";"98830";"DUMBEA";"98805";"PM";"";"";"A";"";"2006-11-07  11:34:50"
"9N1P0981000574";"0981000574";"";"9N1P";"2004-10-05";"2004-11-09";"D";"S";"ASSOCIATION IHNIM";"Aider financièrement les familles des adhérents; Supporter les frais divers de l'association et participer à diverses oeuvres sociales et activités coutumières.";"014000";"019005";"12, rue Dr Schweitzer";"Logicoop";"";"98800";"NOUMEA";"98818";"PM";"";"W9N1010396";"R";"";"2018-12-20  12:05:38"
"9N1P0981000575";"0981000575";"";"9N1P";"2005-11-07";"2005-12-20";"D";"S";"ASSOCIATION AVENIR DES JEUNES DE GAIHNIM";"- Subvenir aux besoins des étudiants et les membres de l'associations; - Manifestation sportive et culturel ( loto, kermesse ) - Omnisport (foot-ball, volley-ball, Pétanque, etc...)";"011000";"020000";"lot 85 Jacarandas Koutio";"";"";"98830";"DUMBEA";"98805";"PM";"";"W9N1010397";"R";"";"2018-12-20  12:10:49"
"9N1P0981000576";"0981000576";"";"9N1P";"2004-10-05";"2004-10-26";"D";"S";"DR~NG~NE TU";"1) Regrouper tous les membres de la famille WANGAN en vue d'établir l'arbre généalogique; 2) Acceuillir les enfants de la famille venant des iles pour poursuivre leurs études et n'ayant aucune ressource financière; 3) Encadrer nos enfants et veillerà ce que les devoirs coutumiers et les démarches coutumières soient respectés; 4) Aide financière aux jeunes en étude...";"015025";"006045";"22, rue Febvrier Despointes";"Vallée du Tir";"";"98800";"NOUMEA";"98818";"PM";"";"W9N1010400";"R";"";"2018-12-20  12:20:12"
"9N1P0981000577";"0981000577";"";"9N1P";"2004-10-06";"2004-11-23";"D";"S";"ASSOCIATION HNADRO RETAL DE NOUMEA";"Rassembler les originaires de la tribu de Hnadro résidant à Nouméa; Développer et mettre en place des activités sociales, culturelles et éducatives tant au niveau paroissiale que coutumier.";"014000";"015000";"16, rue du Capitaine Vidal";"Riviere Salee";"";"98800";"NOUMEA";"98818";"PM";"";"W9N1010398";"R";"";"2018-12-20  12:15:12"
"9N1P0981000578";"0981000578";"";"9N1P";"2004-10-07";"2004-10-26";"D";"S";"ACCOMPAGNEMENT CALEDONIEN VERS L'EVOLUTION SPORTIVE (ACCES)";"* Accompagner sur le plan sportif et scolaire les athlètes pour s'exprimer au plus haut niveau afin de promouvoir l'image de la Nouvelle-Caledonie; * Démarcher, auprès des pouvoirs publics et des sociétés des accords avec les athlètes; * Accompagnerl'athlète dans sa reconversion professionnelle... * Recevoir des subventions ... * Aider au suivi du cursus scolaire et la validation des équivalences... * Intervenir auprès des pouvoirs publics pour la mise en place d'un texte juridique ... .....;";"011000";"000000";"10, rue Lenez Magenta";"BP 436";"";"98800";"NOUMEA";"98818";"PM";"";"W9N1010399";"R";"";"2018-12-20  12:17:31"
"9N1P0981000581";"0981000581";"";"9N1P";"2002-03-19";"2002-04-02";"D";"S";"ASSOCIATION VIOLENCES SEXUELLES ET AUTRES DU MONT-DORE";"- D'aider les personnes violentées d'une façon ou d'une autre, et les enfants violés par inceste et pour tout autre raisons.";"020000";"019000";"Robinson - Mont-Dore";"";"";"98810";"MONT DORE";"98817";"PM";"";"W9N1010401";"R";"";"2018-12-20  12:21:56"
"9N1P0981000583";"0981000583";"";"9N1P";"2002-03-14";"2002-04-02";"D";"S";"CAP SURPRISE";"- La sauvegarde des Récifs d'Entrecasteaux et la mise en place de moyens logistiques permettant à la communauté scientifique l'observation du site.";"024000";"024025";"6 , Impasse Elogette - Nouméa .";"";"";"98800";"NOUMEA";"98818";"PM";"";"W9N1010402";"R";"";"2018-12-20  12:24:38"
