id;id_ex;siret;gestion;date_creat;date_publi;nature;groupement;titre;objet;objet_social1;objet_social2;adr1;adr2;adr3;adrs_codepostal;libcom;adrs_codeinsee;dir_civilite;siteweb;observation;position;rup_mi;maj_time
"9N1P0981001668";"0981001668";"";"9N1P";"1990-03-29";"0001-01-01";"D";"S";"ASSOCIATION 'OSELIANA'";"Animation des quartiers";"006000";"009025";"22, rue des Cassis - Koutio";"";"";"98830";"DUMBEA";"98805";"PM";"";"W9N1009844";"R";"";"2018-11-27  11:39:48"
"9N1P0981001669";"0981001669";"";"9N1P";"1990-04-06";"0001-01-01";"D";"S";"ASSOCIATION TERPSICHORE";"Organiser des rencontres entre parents, élèves et amis de la danse classique ; Organiser des manifestations à caractère culturel et de loisirs ; Promouvoir la danse classique dans le cadre des activités de l'école A. Missegue.";"015000";"006000";"13, rue Jules Ferry";"";"";"98800";"NOUMEA";"98818";"PM";"";"W9N1009845";"R";"";"2018-11-27  11:45:10"
"9N1P0981001672";"0981001672";"";"9N1P";"2001-08-08";"0001-01-01";"D";"S";"VANTCHEMOA 2000";"- Promouvoir la jeunesse à travers des activités culturelles et religieux; - Encourager les jeunes dans les actions pour la défense de la santé : contre la drogue, le sida, la délinquence etc...; - Favoriser les rencontres culturelles dans la communeet les communes environnantes entre les jeunes; - Aide aux jeunes dans leurs déplacements culturels et réligieux.";"016000";"006000";"Tribu de Touaourou Yaté";"";"";"98834";"YATE";"98832";"PM";"";"W9N1009850";"R";"";"2018-11-27  11:00:13"
"9N1P0981001673";"0981001673";"";"9N1P";"2006-08-24";"0001-01-01";"D";"S";"A.E.N.S.H. - ASSOCIATION DES ENFANTS DE NAAMEN ET SUZANNE HONAKOKO";"De réunir des fonds à travers diverses activités telles que (les mini-bingo, les tombolas etc...) afin d'è subvenir aux besoins de l'association c'est à dire : les organisations dites coutumières (mariages, décès etc...";"014000";"019005";"Lot 4, rue de la Fontaine - Les Hameaux Rivière Salée";"";"";"98800";"NOUMEA";"98818";"PM";"";"W9N1009851";"R";"";"2018-11-27  11:03:29"
"9N1P0981001674";"0981001674";"";"9N1P";"2006-08-24";"0001-01-01";"D";"S";"'ROUTE 66 COURSE AU LARGE'";"La gestion et la participation aux régates calédonienne et internationale (course en équipage)";"011000";"011095";"32 lot Berton";"B.P. 13206";"";"98810";"MONT DORE";"98817";"PM";"";"W9N1009852";"R";"";"2018-11-27  11:06:21"
"9N1P0981001677";"0981001677";"";"9N1P";"2006-08-24";"0001-01-01";"D";"S";"CLAN HNAGEJE ET ALLIES";"Faire face aux imprévus : maladies, évasan, aide scolaire ; sensibiliser les jeunes du clan sur les méfaits de l'alcool et du cannabis ; on envisage de monter des mrico-projets (foyer mélanésiens...) en vue de faire travailler et responsabiliser nosjeunes 'sans emplois'";"014000";"019005";"46, rue La Fontaine - 5ème Secteur - Rivière Salée";"";"";"98800";"NOUMEA";"98818";"PM";"";"W9N1009853";"R";"";"2018-11-27  11:08:04"
"9N1P0981001678";"0981001678";"";"9N1P";"2006-08-24";"0001-01-01";"D";"S";"RENCONTRES GEOMATIQUES";"De regrouper les personnes se sentant concernées par la Géomatique en Nouvelle - Calédonie";"014000";"023000";"8, rue Ange Berlioz - appt 14";"B.P. 11138";"";"98800";"NOUMEA";"98818";"PM";"";"W9N1009854";"R";"";"2018-11-27  11:11:14"
"9N1P0981001682";"0981001682";"";"9N1P";"2006-08-25";"0001-01-01";"D";"S";"MARKETING MOVE EVOLUTION";"- De motiver la jeunesse calédonienne tout en reversant des fonds à d'autres associations caritatives.";"022540";"015045";"3 , rue Soeur Théodonie , Hameaux de la colline - Magenta";"B.P. 1542";"";"98800";"NOUMEA";"98818";"PM";"";"W9N1009855";"R";"";"2018-11-27  11:12:49"
"9N1P0981001684";"0981001684";"";"9N1P";"2006-08-25";"0001-01-01";"D";"S";"COUË - LA FORÊT - ( COMMUNAUTE D'ORO UNIE POUR L'ENVIRONNEMENT)";"- La protection du patrimoine naturel de la baie d'Oro et de ses environs par l'intermédiaire d'actions diverses: * Plantation d'arbres ( essences du territoires ) * Nettoyage de la plage de la baie d'Oro et de l'intérieur des terres * Nettoyage dessentiers pédestres.";"024000";"024035";"La tribu de Touété - Ile des Pins";"";"";"98832";"ILES DES PINS";"98809";"PM";"";"W9N1009856";"R";"";"2018-11-27  11:17:29"
"9N1P0981001696";"0981001696";"";"9N1P";"1985-06-21";"0001-01-01";"D";"S";"ACADAM COMPANY";"Promotion de la danse et du théâtre";"006000";"006040";"19, rue du Révérend Père - Romain Vallée des Colons";"";"";"98800";"NOUMEA";"98818";"PM";"";"W9N1009857";"R";"";"2018-11-27  11:33:29"
"9N1P0981001698";"0981001698";"";"9N1P";"1986-07-18";"0001-01-01";"D";"S";"ASSOCIATION CULTURELLE DES FRANCAIS DE L'INDE ET AMIS DE L'INDE";"Regroupement des Français originaires de l'Inde et de leurs amis ; enseignement des langues indiennes ; aide aux personnes d'origine indienne ; construction d'un centre culturel , création de commissions et ligues ; organisation de voyages en Inde";"006000";"016000";"34, bis, rue d'Austerlitz,";"";"";"98800";"NOUMEA";"98818";"PM";"";"W9N1009858";"R";"";"2018-11-27  11:40:39"
"9N1P0981001699";"0981001699";"";"9N1P";"1981-07-03";"0001-01-01";"D";"S";"COMITE DES AMICALES FOLKLORIQUES ET CULTURELLES - C.A.F.E.C.";"Faire découvrir et apprécier les carctères particuliers de chaque groupe ethnique ou amicale folklorique ivant sur le Territoire. Créer ou resserrerles liens d'amitié entre ces amicales. Elargir l'esprit d'entraide et de compréhension humaine. Coordonner les différentes activités de amicales conernées.";"006000";"009025";"1, rue Charles de Verneilh";"B.P. 3944";"";"98800";"NOUMEA";"98818";"PM";"";"W9N1009846";"R";"";"2018-11-27  11:48:21"
"9N1P0981001700";"0981001700";"";"9N1P";"1986-04-15";"0001-01-01";"D";"S";"ASSOCIATION DES PERSONNELS DE L'EDUCATION SPECIALISEE (A.P.E.S.)";"Promouvoir l'adaptation, l'intégration scolaire, l'éducation et l'enseignement spécialisés.";"015000";"015035";"7, bis, rue du Gouverneur Testard - Vallée des Colons";"B.P. 941";"";"98800";"NOUMEA";"98818";"PM";"";"W9N1009847";"R";"";"2018-11-27  11:51:50"
"9N1P0981001701";"0981001701";"";"9N1P";"1982-10-11";"0001-01-01";"D";"S";"CAGOU CIBI CLUB";"Pratique de la cibi.";"007000";"005025";"2, rue Bolivar - Cité Normandie";"B.P. 6029 Rivière Salée";"";"98800";"NOUMEA";"98818";"PM";"";"W9N1009849";"R";"";"2018-11-27  11:56:59"
"9N1P0981001702";"0981001702";"";"9N1P";"2006-08-31";"0001-01-01";"D";"S";"ASSOCIATION CULTURELLE ET TRADITIONNELLE AKUILA EN NOUVELLE-CALEDONIE";"Promouvoir la culture et d'organiser les rencontres entre jeunes afin de retrouver les repères et de se réinsérer dans la tradition mais surtout dans la société.";"006000";"006045";"43, rue Betford - Rivière Salée";"B.P. 3661";"";"98800";"NOUMEA";"98818";"PM";"";"W9N1009848";"R";"";"2018-11-27  11:54:33"
"9N1P0981001706";"0981001706";"";"9N1P";"1985-12-05";"0001-01-01";"D";"S";"ASSOCIATION BWENANDO";"Edition - Publication - Diffusion de journauxs et autres publications";"005000";"005005";"8, rue Gambetta - Vallée du Tir";"";"";"98800";"NOUMEA";"98818";"PM";"";"W9N1009816";"R";"";"2018-11-22  11:12:37"
"9N1P0981001707";"0981001707";"";"9N1P";"1985-11-22";"0001-01-01";"D";"S";"AMERICAL MUSEUM ASSOCIATION";"Sauvergard et mise en valeur du patrimoine de la guerre du Pacifique ; Animations culturelles";"006000";"010015";"23, rue Jules Ferry";"";"";"98800";"NOUMEA";"98818";"PM";"";"W9N1005481";"R";"";"2016-07-19  07:20:10"
"9N1P0981001708";"0981001708";"";"9N1P";"1977-07-07";"0001-01-01";"D";"S";"LES AMIS DE L'HISTOIRE DE L'ART";"Enseigner, promouvoir, développer la culture de l'histoire de l'art.";"006000";"000000";"2, rue Paddon, Vallon du Gaz";"";"";"98800";"NOUMEA";"98818";"PM";"";"W9N1009815";"R";"";"2018-11-22  11:08:50"
"9N1P0981001709";"0981001709";"";"9N1P";"1985-04-26";"0001-01-01";"D";"S";"LES ARTISTES CALEDONIENS";"Proumouvoir les artistes locaux ; Aider notamment matériellement et physiquement les artistes et toutes les personnes susceptibles d'avoir des talents cachés qui résident sur le Territoire, les former et les hausser au niveau national voire international ; organiser un gala par mois ou toutes autres activités culturelles. Pourquoi un gala par mois ? Ce n'est pas un but d'attraction car notre but fondamental est d'aider les jeunes...";"006000";"009025";"12 bis, rue du Gal Mangin dénommé ""Le Richelieu"" 4ème Niv";"";"";"98800";"NOUMEA";"98818";"PM";"";"W9N1009817";"R";"";"2018-11-22  11:14:42"
"9N1P0981001712";"0981001712";"";"9N1P";"1985-04-16";"0001-01-01";"D";"S";"DELEGATION CALEDONIENNE AU FESTIVAL DES ARTS";"Préparation d ela Délégation de Nouvelle - Calédonie au 5ème festival des Arts du Pacifique de Townsville, en liaison avec le comité organisateur.";"006000";"006045";"Imm. Foch - 6ème étage Gouvernement";"B.P. C5";"";"98800";"NOUMEA";"98818";"PM";"";"W9N1009818";"R";"";"2018-11-22  11:23:19"
"9N1P0981001713";"0981001713";"";"9N1P";"1985-06-12";"0001-01-01";"D";"S";"DANSE ET CHOREGRAPHIE";"Favoriser la connaissance et la pratique de la danse artistique ; entretenir des rapports amicaux entre professeurs, élèves, parents d'élèves, ex-élèves del 'Ecole de danse Josy MILLER";"006000";"006040";"38, rue de Verdun";"";"";"98800";"NOUMEA";"98818";"PM";"";"W9N1009823";"R";"";"2018-11-22  11:59:59"
"9N1P0981001715";"0981001715";"";"9N1P";"1974-05-02";"0001-01-01";"D";"S";"COMPAGNIE DES TRETEAUX CALEDONIENS";"Création, réalisation, production d'oeuvres artistiques et culturelles susceptibles d'être représentées publiquement en Nouvelle - Calédonie et en tout autres pays";"006000";"000000";"Théâtre de l'Ile - Nouville";"B.P. 41";"";"98800";"NOUMEA";"98818";"PM";"";"W9N1009824";"R";"";"2018-11-22  11:03:37"
"9N1P0981001716";"0981001716";"";"9N1P";"1980-10-10";"0001-01-01";"D";"S";"ASSOCIATION 'ECHANGE ET CULTURE'";"Susciter et développer les échanges culturels";"006000";"006100";"Collège Georges Baudoux - Avenue des Frères Carcopino";"B.P. n° 1794";"";"98800";"NOUMEA";"98818";"PM";"";"W9N1009825";"R";"";"2018-11-22  11:06:27"
"9N1P0981001717";"0981001717";"";"9N1P";"1981-03-20";"0001-01-01";"D";"S";"ENTENTE DES JEUNES DE MONTRAVEL";"Amener les jeunes de Mont-Ravel à se prendre en charge en organisant leur loisir pour développer leur personnalité physique et culturelle.";"006000";"009025";"Salle paroissiale de Mont - Ravel";"";"";"98800";"NOUMEA";"98818";"PM";"";"W9N1009826";"R";"";"2018-11-22  11:10:30"
"9N1P0981001719";"0981001719";"";"9N1P";"1971-08-24";"0001-01-01";"D";"S";"CLUB DE BRIDGE A. PROUD";"Pratique du bridge, organisation de concours, de tournois ou compétitions...";"007000";"007080";"Lot 14, rue Montcalm - Faubourg Blanchot";"";"";"98800";"NOUMEA";"98818";"PM";"";"";"A";"";"2006-11-07  11:34:51"
"9N1P0981001720";"0981001720";"";"9N1P";"1981-02-12";"0001-01-01";"D";"S";"L'ENTREE DES ARTISTES";"Promotion des oeuvres locales, musicales et littéraires";"006000";"006070";"Syndicat d'initiative de Nouméa";"";"";"98800";"NOUMEA";"98818";"PM";"";"W9N1009838";"R";"";"2018-11-27  11:08:02"
"9N1P0981001721";"0981001721";"";"9N1P";"1980-02-12";"0001-01-01";"D";"S";"CENTRE DE RECONTRES ET D'ECHANGES INTERNATIONAUX DU PACIFIQUE SUD (CREIPAC)";"Contribuer au moyen de la langue française au développement des relations et des échanges internationaux dans la région océanienne, dans les domaines touchant à la langue, à la culture, à la science et à la technologie, en tirant parti de la spécificité océanienne de la Nouvelle-Calédonie au sein de la communauté de langue française.";"006000";"010015";"B.P. 3765";"";"";"98800";"NOUMEA";"98818";"PM";"";"W9N1009839";"R";"";"2018-11-27  11:23:17"
"9N1P0981001723";"0981001723";"";"9N1P";"2006-09-06";"0001-01-01";"D";"S";"ASSOCIATION WATAMEVA";"Préparer la noël 2006 pour les enfants du quartier Jacarandas 2 - Accéder à un terrain municipal ou autre afin de construire une maison de quartier pour nos jeunes";"020000";"007000";"Appt D1/03 résidence Georges Bizet rue G. Fauré";"Jacarandas 2 - Koutio";"";"98830";"DUMBEA";"98805";"PM";"";"W9N1009841";"R";"";"2018-11-27  11:33:34"
"9N1P0981001724";"0981001724";"";"9N1P";"2006-09-06";"0001-01-01";"D";"S";"ASSOCIATION CAS ME IHNIM";"De récolter des fonds et tendre la main de l'ordre social et culturel";"014000";"019040";"66, rue Pervenche Benton - Vallon dore";"";"";"98810";"MONT DORE";"98817";"PM";"";"W9N1009842";"R";"";"2018-11-27  11:35:27"
"9N1P0981001726";"0981001726";"";"9N1P";"2000-01-14";"0001-01-01";"D";"S";"ASSOCIATION POUR L'ETUDE DES REGIMES DE RETRAITE EN NOUVELLE-CALEDONIE (A.S.P.E.R.R.)";"Une meilleure connaissance des régimes de retraite des salariés des secteurs publics (non fonctionnaires) et privés.";"014000";"022545";"Immeuble Jules Ferry, 1 rue de la Somme";"B.P. 466";"";"98800";"NOUMEA";"98818";"PM";"";"W9N1009797";"R";"";"2018-11-21  11:44:46"
"9N1P0981001727";"0981001727";"";"9N1P";"2006-09-07";"0001-01-01";"D";"S";"JEUNES D'ATALAS";"Promotion artistique de C.D. : Animation musicale";"006000";"000000";"106 avenue Koénig Rivière Salée";"B.P. 2716";"";"98800";"NOUMEA";"98818";"PM";"";"W9N1009798";"R";"";"2018-11-21  11:58:01"
"9N1P0981001730";"0981001730";"";"9N1P";"1986-02-20";"0001-01-01";"D";"S";"ASSOCIATION HEI - FARA";"Rassembler tous les jeunes gens d'origine polynésienne ; défendre les intérêts moraux et culturels : mettre à la disposition des membres des moyens d'information.";"006000";"009025";"Lotissement Bernut - lot 145 Robinson";"";"";"98810";"MONT DORE";"98817";"PM";"";"W9N1009799";"R";"";"2018-11-21  11:01:57"
"9N1P0981001731";"0981001731";"";"9N1P";"1984-11-23";"0001-01-01";"D";"S";"GROUPE MADININA";"Danse folklorique antillaise";"006000";"016000";"A la SCET bât n° 7 - studio n° 1 ducos";"";"";"98800";"NOUMEA";"98818";"PM";"";"W9N1009800";"R";"";"2018-11-21  11:06:36"
"9N1P0981001732";"0981001732";"";"9N1P";"1982-10-18";"0001-01-01";"D";"S";"GROUPE VENT DU NORD";"La promotion artistique du patrimoine culturel et folklorique méréen.";"006000";"010015";"C/o Mme Urégei Sissawanw";"8, rue de Lyon - Rivière Salée";"";"98800";"NOUMEA";"98818";"PM";"";"W9N1009801";"R";"";"2018-11-21  11:18:47"
"9N1P0981001733";"0981001733";"";"9N1P";"1979-12-27";"0001-01-01";"D";"S";"INSTITUT CULTUREL MELANESIEN";"Mieux faire connaître la civilisation mélanésienne - préserver ses valeurs traditionnelles et de les diffuser - d'aider à la conservation et à la diffusion des langues vernaculaires - participer à toutes manifestations à caractère culturel ayant pourbut la reconnaissance de la culture canaque, comme culture originelle.";"006000";"016000";"C.E.F.A. - Avenue Paul Doumer";"B.P. C5";"";"98800";"NOUMEA";"98818";"PM";"";"W9N1009808";"R";"";"2018-11-22  11:34:33"
"9N1P0981001734";"0981001734";"";"9N1P";"1982-07-20";"0001-01-01";"D";"S";"FEDERATION TERRITORIALE DES SYNDICATS D'INITIATIVE ET OFFICES MUNICIPAUX DE TOURISME DE NOUVELLE-CALEDONIE ET DEPENDANCES.";"L'unification, la coordination et le soutien de l'action des syndicats d'initiative et offices municipaux de tourisme ; la programmation rationnelle de toutes les manifestations importantes dans le territoire, afin d'éviter des chevauchements ; leurreprésentation au sein de toutes les instances territoriales intéressées au tourisme, et, leurs liaisons avec les collectivités publiques ou privées ; le développement de l'accueil, de l'information, de l'animation et d'une manière générale...";"006000";"006020";"39, r16071982ue Jean Jaurès (ancienne Mairie de Néa)";"B.P. 932";"";"98800";"NOUMEA";"98818";"PM";"";"W9N1009809";"R";"";"2018-11-22  11:41:43"
"9N1P0981001735";"0981001735";"";"9N1P";"1983-09-12";"0001-01-01";"D";"S";"ASSOCIATION EDITIONS I.K.S. (LIBRAIRIE POPULAIRE)";"De diffuser, de produire et de promouvoir des livres : - diffuser des livres qui sont interdits de fait par les libraires de Nouvelle-Calédonie, - produire des livres sur des problèmes actuels de la Nouvelle-Calédonie, - promouvoir la littérature Kanake en suscitant l'écriture et la publication.";"006000";"006010";"B.P. 4713";"";"";"98800";"NOUMEA";"98818";"PM";"";"W9N1009810";"R";"";"2018-11-22  11:52:21"
"9N1P0981001736";"0981001736";"";"9N1P";"1980-07-02";"0001-01-01";"D";"S";"FOYER MELANESIEN";"Favoriser les rencontres, les activités socio - éducatives et culturelles de ses membres.";"007000";"007075";"C.E.F.A. Avenue Paul Doumer";"B.P. C5";"";"98800";"NOUMEA";"98818";"PM";"";"W9N1009811";"R";"";"2018-11-22  11:55:56"
"9N1P0981001737";"0981001737";"";"9N1P";"1985-12-16";"0001-01-01";"D";"S";"FOYER SOCIO-EDUCATIF DU COLLEGE CHAMPAGNAT";"Favoriser dans le collège une forme éducative de vie collective";"015000";"003060";"Rue Albert 1er - Cité Saint Louis Vallée des Colons";"B.P. 2075";"";"98800";"NOUMEA";"98818";"PM";"";"W9N1009812";"R";"";"2018-11-22  11:59:00"
"9N1P0981001744";"0981001744";"";"9N1P";"2006-09-18";"0001-01-01";"D";"S";"ASSOCIATION DES LOCATAIRES 'DE DONIAMBO'";"D'être reconnue, représentée auprès de la SLN, et de son comité d'entreprise (commission des logements) ; d'être reconnue et représentée auprès des pouvoirs publics ; de se documenter et d'intervenir dans l'intérêt des résidents dans la cité ; de veiller à la défense des intérêts des résidents ; de promouvoir des logements décents aux familles présentes ou arrivant dans la cité, de susciter et de développer toutes actions capables d'accrôitre le rayonnement de la cité,...";"014000";"032520";"Maison de quartier de la Vallée du Tir";"35 bis, rue Edouard Unger";"";"98800";"NOUMEA";"98818";"PM";"";"W9N1009813";"R";"";"2018-11-22  11:02:48"
"9N1P0981001747";"0981001747";"";"9N1P";"2006-09-19";"0001-01-01";"D";"S";"GROUPEMENT DES PARENTS D'ETUDIANTS EN FRANCE, PACIFIQUE, NOUVELLE-CALEDONIE (GPE - FPNC)";"Contribuer par la concertation, la réflexion et la mise en oeuvre d'actions spécifiques à la réussite des étudiants effectuant des études supérieures en Nouvelle-Calédonie, en France et dans la région du Pacifique.";"015000";"015005";"Case du CEFA, rue Paul Doumer Centre Ville";"";"";"98800";"NOUMEA";"98818";"PM";"";"W9N1009814";"R";"";"2018-11-22  11:06:25"
"9N1P0981001750";"0981001750";"";"9N1P";"2006-09-19";"0001-01-01";"D";"S";"ASSOCIATION TUBURIN";"Promouvoir les échanges artistiques entre les artistes originaires de l'île d'Ambrym (Vanuatu) et les artistes de Nouvelle - Calédonie.";"006000";"016000";"19, route de Sainte Marie";"";"";"98800";"NOUMEA";"98818";"PM";"";"W9N1009735";"R";"";"2018-11-13  11:12:30"
"9N1P0981001751";"0981001751";"";"9N1P";"1995-09-05";"0001-01-01";"D";"S";"ASSOCIATION DES PARENTS D'ELEVES DE L'ECOLE MATERNELLE 'LES CAPUCINES'";"De créer des liens entre les parents et les enfants élèves de la maternelle ; de permettre une collaboration étroite entre l'école et les familles ; d'éclairer les parents sur le rôle de l'éducateur ; d'être présente dans l'école pour participer à lamise en oeuvre de moyens nécessaires à l'amélioration du cadre de vie des enfants dans l'école ; de subvenir financièrement en organisant des festivités dont les recettes serviront à acheter du matériel éducatif et pédagogique des enfants de l'école";"015000";"015005";"41, rue Taragnat, Vallée des Colons";"";"";"98800";"NOUMEA";"98818";"PM";"";"";"A";"";"2006-11-07  11:34:51"
"9N1P0981001752";"0981001752";"";"9N1P";"1983-08-25";"0001-01-01";"D";"S";"SYNDICAT D'INFIRMIERS ET INFIRMIERES DIPLOMES D'ETAT EXERCANT A TITRE LIBERAL";"Défendre les intérêts moraux et matériels de ses adhérents ; d'étudier les questions professionnelles, économiques, sociales et morales de ses membres ; de rechercher les moyens de résoudre les problèmes intéressant l'activité de ses adhérents ; de lutter contre l'exercice illégal de la profession.";"014000";"014030";"B.P. 4538";"";"";"98800";"NOUMEA";"98818";"PM";"";"";"D";"";"2006-11-07  11:34:51"
"9N1P0981001753";"0981001753";"";"9N1P";"2006-09-20";"0001-01-01";"D";"S";"ASSOCIATION DES SQUATTERS DU CAILLOU BLANC";"D'amener le minimum de confort aux habitants du squatt par l'acquisition d'un compteur d'eau.";"014000";"023002";"B.P. 17140";"";"";"98800";"NOUMEA";"98818";"PM";"";"W9N1006372";"R";"";"2018-09-25  09:41:03"
"9N1P0981001755";"0981001755";"";"9N1P";"1982-08-19";"0001-01-01";"D";"S";"FOYER SOCIO EDUCATIF DU L.E.P. COMMERCIAL";"De favoriser dans l'établissement une forme éducative de vie collective : promouvoir, coordonner et éventuellement animer toutes les activités culturelles et sociales de l'établissement ; organiser et coordonner toutes les réunions d'informations culturelles, philosophiques, religieuses, économiques, sociales etc...";"015000";"015025";"Lycée Lapérouse, rue Georges Baudoux";"B.P. M5";"";"98800";"NOUMEA";"98818";"PM";"";"W9N1009734";"R";"";"2018-11-13  11:10:22"
"9N1P0981001756";"0981001756";"";"9N1P";"1982-09-03";"0001-01-01";"D";"S";"FOYER SOCIO-EDUCATIF DU L.E.P. PETRO ATTITI";"Favoriser d'enseignement professionnel Pétro ATTITI - RIVIERE SALEE";"015000";"015025";"B.P. K2";"";"";"98800";"NOUMEA";"98818";"PM";"";"W9N1005046";"R";"";"2015-03-26  03:16:07"
"9N1P0981001757";"0981001757";"";"9N1P";"1985-07-19";"0001-01-01";"D";"S";"ALLIANCE AUSTRALO-CALEDONIENNE";"Ressérer tous les liens culturels et touristiques avec l'Australie et aider à une meilleure perception de l'Australie.";"014000";"023040";"Imm. le Petit Belvédère appt n° 11";"Rue Antoine Griscelli Rivière Salée";"";"98800";"NOUMEA";"98818";"PM";"";"W9N1009733";"R";"";"2018-11-13  11:08:06"
"9N1P0981001762";"0981001762";"";"9N1P";"2006-09-22";"0001-01-01";"D";"S";"ASSOCIATION VEI - VAI";"Les danses polynésiennes et autres (moderne)";"006000";"009025";"7, rue Paul Vois - Doniambo - Cité SLN";"";"";"98800";"NOUMEA";"98818";"PM";"";"W9N1009732";"R";"";"2018-11-13  11:04:12"
"9N1P0981001764";"0981001764";"";"9N1P";"2006-09-22";"0001-01-01";"D";"S";"ASSOCIATION DES RESIDENTS DU VAL DE MAGENTA IV";"De prendre en compte les difficultés rencontrées par les résidents, de défendre leurs intérêts et d'améliorer ou préserver leur cadre de vie.";"014000";"032520";"C2.21 - 5, rue Raymond Brun";"";"";"98800";"NOUMEA";"98818";"PM";"";"W9N1009731";"R";"";"2018-11-13  11:01:54"
"9N1P0981001766";"0981001766";"";"9N1P";"2004-02-23";"0001-01-01";"D";"S";"ASSOCIATION HANAWA";"Recueillir toutes formes de financement au bénéfice de M. Kaloi, et d'autres membres de la liste du mouvement 'Ensemble pour l'avenir' pour le financement des campagnes...";"001000";"001005";"Bât. F - tours de magenta";"B.P. 6904";"";"98800";"NOUMEA";"98818";"PM";"";"W9N1009729";"R";"";"2018-11-13  11:59:00"
"9N1P0981001767";"0981001767";"";"9N1P";"2001-04-19";"0001-01-01";"D";"S";"ASSOCIATION TRO FE NI";"Rassembler les jeunes de la tribu de Jokin ; Aider sous toutes ces formes (financier, morales, physiques...) aux différents projets et activités des jeunes.";"014000";"018010";"Tours de bât E appt 141 - magenta";"";"";"98800";"NOUMEA";"98818";"PM";"";"W9N1009728";"R";"";"2018-11-13  11:55:13"
"9N1P0981001769";"0981001769";"";"9N1P";"2006-09-26";"0001-01-01";"D";"S";"DHOYOQ NAUSARIEN ASSOCIATION";"- D'entretenir et de cultiver le terrain domaniale où nous vivons et d'aasurer la vie des familles existantes sur le terrain et d'accompagner la vie scolaire et culturelles de nos enfants , organiser des journées récréatives , sportives et culturelles.";"014000";"030005";"Route Montagne des sources - Lot Schonn La Coulée.";"BP 5344 - 98874 - Plum";"";"98810";"MONT DORE";"98817";"PM";"";"W9N1009727";"R";"";"2018-11-13  11:53:30"
"9N1P0981001770";"0981001770";"";"9N1P";"2006-09-26";"0001-01-01";"D";"S";"HOKIHA";"-Rassembler la jeunesse wallisienne et futunienne du Mont-Dore , afin de promouvoir ensemble notre culture.";"020000";"010015";"151 Lotissement Bernut - Robinson Mt-Dore";"";"";"98810";"MONT DORE";"98817";"PM";"";"W9N1009726";"R";"";"2018-11-13  11:50:30"
"9N1P0981001773";"0981001773";"";"9N1P";"2006-09-28";"0001-01-01";"D";"S";"ASSOCIATION ENVERS ET CONTRE TOUS POUR LES MALADES ET EVACUES.";"Aider les malades et évacués dans leurs démarches ; soutenir les malades et évacués moralement ; soutenir les familles de malades.";"017000";"017075";"33 lot les Mussandas - Yahoué";"B.P. 2468";"";"98810";"MONT DORE";"98817";"PM";"";"W9N1009725";"R";"";"2018-11-13  11:28:57"
"9N1P0981001775";"0981001775";"";"9N1P";"2006-09-28";"0001-01-01";"D";"S";"KICK BOXING CLUB CALEDONIEN";"Le regroupement de moyens et de compétences, la promotion et le développement du kick-boxing, du light, cardio et aéro kick -boxing, kick-boxing défense et du full contact sous toutes ses formes ; le développement et l'organisation de la pratique desactivités physiques, et sportives et de loisirs ; l'organisation des compétitions et manifestations diverses ; le regroupement des intérêts des pratiquants, le dialogue avec la fédération française de kick-boxing et disciplines associées, la ligue..";"011000";"000000";"55, rue de la Rivièra";"";"";"98800";"NOUMEA";"98818";"PM";"";"W9N1009724";"R";"";"2018-11-13  11:25:21"
"9N1P0981001776";"0981001776";"";"9N1P";"1987-08-10";"1987-08-08";"D";"S";"ASSOCIATION CALEDONIENNE DES ELEVEURS DE PIGEONS";"- Promotion de l'élevage du pigeon sous toutes ses formes et la défense des éleveurs membres de l'association.";"014000";"020000";"Lot 14 , Val Fleuri - Dumbéa";"";"";"98830";"DUMBEA";"98805";"PM";"";"W9N1009723";"R";"";"2018-11-13  11:22:49"
"9N1P0981001778";"0981001778";"";"9N1P";"1997-12-12";"0001-01-01";"D";"S";"TAE KWONDO CLUB CALEDONIEN";"Initiation et perfectionnement du Taekwondo";"011000";"011145";"25, rue Révérend Père Fénoyl - Trianon";"";"";"98800";"NOUMEA";"98818";"PM";"";"";"A";"";"2006-11-07  11:34:52"
